{
  "$schema": "https://json-schema.org/draft/2020-12/schema",
  "title": "EquineSync Configuration Package Manifest",
  "type": "object",
  "additionalProperties": false,
  "required": [
    "package_name",
    "package_version",
    "framework_version",
    "files"
  ],
  "properties": {
    "package_name": {
      "type": "string",
      "minLength": 1
    },
    "package_version": {
      "type": "string",
      "minLength": 1
    },
    "framework_version": {
      "type": "string",
      "minLength": 1
    },
    "generated_at": {
      "type": "string",
      "format": "date-time"
    },
    "files": {
      "type": "array",
      "items": {
        "type": "object",
        "required": [
          "path",
          "sha256",
          "bytes"
        ],
        "properties": {
          "path": {
            "type": "string",
            "minLength": 1
          },
          "sha256": {
            "type": "string",
            "pattern": "^[0-9a-f]{64}$"
          },
          "bytes": {
            "type": "integer",
            "minimum": 0
          },
          "category": {
            "type": "string"
          }
        },
        "additionalProperties": false
      }
    }
  }
}
